{"type":"config","name":"Minimize main.py while preserving exact submission hash","metricName":"score","metricUnit":"","bestDirection":"lower"}
{"run":1,"commit":"05036c0","metric":130113886783,"metrics":{},"status":"keep","description":"baseline: current full pipeline with exact hash; added run_pipeline.sh/autoresearch.sh/autoresearch.md benchmark harness","timestamp":1774007958740,"segment":0,"confidence":null}
{"run":2,"commit":"7d0232a","metric":112004758481,"metrics":{},"status":"keep","description":"AST-based syntax-preserving minification: removed docstrings/comments via unparse and stripped function annotations; main.py 130112→112003 chars with exact hash and slightly faster runtime","timestamp":1774009830693,"segment":0,"confidence":null}
{"run":3,"commit":"db81ccb","metric":99979781930,"metrics":{},"status":"keep","description":"Removed report/config/save machinery, switched to direct train.csv/test.csv reads, always rebuild artifacts fresh, and simplified run_pipeline to only fit + write submission","timestamp":1774012045273,"segment":0,"confidence":2.5059595522033713}
{"run":4,"commit":"c5c3a8c","metric":98358796252,"metrics":{},"status":"keep","description":"Removed extra annotated-assignment syntax, deleted the semantic-context dataclass wrapper, and trimmed more setup bookkeeping while preserving the exact train/test pipeline","timestamp":1774014124139,"segment":0,"confidence":4.654137245597091}
{"run":5,"commit":"e85366b","metric":97992794448,"metrics":{},"status":"keep","description":"Removed a few more dead imports/parameters and collapsed semantic-context capture/activation to plain tuple passing","timestamp":1774016103820,"segment":0,"confidence":16.16572455839961}
{"run":6,"commit":"98fb2dc","metric":95975804830,"metrics":{},"status":"keep","description":"Shortened a batch of long internal identifiers (semantic/scenario/override plumbing names) with no behavior change","timestamp":1774018019515,"segment":0,"confidence":15.623911557903485}
{"run":7,"commit":"4c20506","metric":95193829154,"metrics":{},"status":"keep","description":"Shortened another batch of long global constants/column-set identifiers (USECOLS/raw/string map names etc.) with no behavior change","timestamp":1774019967047,"segment":0,"confidence":14.653874666360423}
{"run":8,"commit":"01111f1","metric":93853840995,"metrics":{},"status":"keep","description":"Shortened another batch of common local variable names (feature/mask/probability/temp counters etc.) with no behavior change","timestamp":1774021914460,"segment":0,"confidence":13.99473124738466}
{"run":9,"commit":"dd2a642","metric":90597815108,"metrics":{},"status":"keep","description":"Shortened helper-method names and more common locals (curve/scenario/train-temp names etc.) with no behavior change; pruned stale idea backlog entry","timestamp":1774023942842,"segment":0,"confidence":14.118099913460377}
{"run":10,"commit":"d17c247","metric":89611756216,"metrics":{},"status":"keep","description":"Shortened class/import aliases, more helper/function names, and several remaining long tuning constants with no behavior change","timestamp":1774025801835,"segment":0,"confidence":13.22315412334285}
{"run":11,"commit":"114540e","metric":87821799861,"metrics":{},"status":"keep","description":"Shortened several internal engineered feature/column names (device_family, hard-rule/scenario names, residual-calibration prefixes, etc.) with no behavior change","timestamp":1774027728280,"segment":0,"confidence":10.56251968124393}
{"run":12,"commit":"20781ca","metric":84932799496,"metrics":{},"status":"keep","description":"Shortened another batch of internal identifiers (feature ratio names, helper args, cross-validation and integrity variables, etc.) with no behavior change; main.py 87820→84931 chars while preserving exact submission hash","timestamp":1774032261026,"segment":0,"confidence":9.631474539230682}
{"run":13,"commit":"eeadb0f","metric":81647786879,"metrics":{},"status":"keep","description":"Removed the dead first tune_threshold method and shortened another broad batch of helper names, constants, and internal feature-column names with no behavior change; main.py 84931→81646 chars while preserving the exact submission hash","timestamp":1774034362533,"segment":0,"confidence":10.126740102209483}
{"run":14,"commit":"715b6c1","metric":77941774487,"metrics":{},"status":"keep","description":"Shortened another broad batch of residual/scenario/curve feature names plus remaining helper, attribute, and local identifiers with no behavior change; main.py 81646→77940 chars while preserving the exact submission hash","timestamp":1774036376412,"segment":0,"confidence":10.06403991177447}
{"run":15,"commit":"897cff0","metric":75889778799,"metrics":{},"status":"keep","description":"Shortened another batch of remaining hard-rule names, tuning locals, fold-feature columns, and residual/freqdroop feature names with no behavior change; main.py 77940→75888 chars while preserving the exact submission hash","timestamp":1774038289767,"segment":0,"confidence":8.989346521256664}
{"run":16,"commit":"897cff0","metric":0,"metrics":{},"status":"crash","description":"Tried hoisting stateless helper methods to module scope, but a naive prefix replacement corrupted calls like self._nsm/self._ncm into undefined globals; reverted after NameError during fit","timestamp":1774038524231,"segment":0,"confidence":8.989346521256664}
{"run":17,"commit":"aacf17a","metric":74687773574,"metrics":{},"status":"keep","description":"Hoisted the stateless math/selection helpers out of class scope and updated call sites with a safer exact replacement pass; main.py 75888→74686 chars while preserving the exact submission hash","timestamp":1774040355005,"segment":0,"confidence":8.256536064516833}
{"run":18,"commit":"aacf17a","metric":0,"metrics":{},"status":"crash","description":"Tried another broad local-name shortening pass, but one rename collided in _bta so the family DataFrame and directory path both became fd, breaking to_parquet with a pandas/path TypeError; reverted","timestamp":1774040594681,"segment":0,"confidence":8.256536064516833}
{"run":19,"commit":"4c3beb0","metric":73485785444,"metrics":{},"status":"keep","description":"Shortened another safe batch of remaining local identifiers plus the last long internal DC/freqdroop/target feature names, with a narrower non-colliding rename set after the prior crash; main.py 74686→73484 chars while preserving the exact submission hash","timestamp":1774042455331,"segment":0,"confidence":7.296513197017504}
{"run":20,"commit":"db895d5","metric":72247775534,"metrics":{},"status":"keep","description":"Shortened another safe batch of shared column/field constants plus remaining one-off locals and internal feature names (DC, phase-error, freqdroop, watt-limit terms) with no behavior change; main.py 73484→72246 chars while preserving the exact submission hash","timestamp":1774044311032,"segment":0,"confidence":6.925507604884042}
{"run":21,"commit":"3367424","metric":71808798361,"metrics":{},"status":"keep","description":"Hoisted another batch of pure helper functions (encoding/binning/hash/stat aggregation/candidate builders) out of class scope and fixed their signatures for direct global calls; main.py 72246→71807 chars while preserving the exact submission hash","timestamp":1774046205286,"segment":0,"confidence":6.665693558282006}
{"run":22,"commit":"3367424","metric":0,"metrics":{},"status":"crash","description":"Tried another rename pass on remaining locals/feature names, but renaming cat_features also rewrote the CatBoost fit keyword to an invalid cfs= argument; reverted","timestamp":1774046741376,"segment":0,"confidence":6.665693558282006}
{"run":23,"commit":"7f10866","metric":71295779454,"metrics":{},"status":"keep","description":"Hoisted another batch of pure helpers (_cn/_bsw/_bsf/_bsk/_bok/_afi) out of class scope and shortened internal hyperparameter attribute names while preserving external library keyword args; main.py 71807→71294 chars with exact submission hash","timestamp":1774048745397,"segment":0,"confidence":5.761673568848253}
{"run":24,"commit":"f29224b","metric":70592815552,"metrics":{},"status":"keep","description":"Applied another exact-token shortening pass on remaining local variables and internal feature terms (residual magnitudes, mode flags, DC/freqdroop temporaries, curve metadata, and capacity-rating locals) without touching external API keywords; main.py 71294→70591 chars with exact submission hash","timestamp":1774050668916,"segment":0,"confidence":5.64877020189918}
{"run":25,"commit":"3a2a3ca","metric":70133830440,"metrics":{},"status":"keep","description":"Applied another exact-token shortening pass on remaining locals and internal feature names (threshold/temp/id/curve/catprob/model-integrity terms plus internal block labels) while avoiding external API keywords; main.py 70591→70132 chars with exact submission hash","timestamp":1774052591678,"segment":0,"confidence":5.147393488063005}
{"run":26,"commit":"3a2a3ca","metric":0,"metrics":{},"status":"crash","description":"Tried another broad exact-token rename pass, but shortening internal chunksize also rewrote pandas.read_csv(chunksize=...) into invalid csz=; reverted and reinforced that external API keywords need an explicit denylist","timestamp":1774052656780,"segment":0,"confidence":5.147393488063005}
{"run":27,"commit":"d8287ef","metric":69560835297,"metrics":{},"status":"keep","description":"Re-applied a narrower exact-token shortening pass after the chunksize crash, safely renaming remaining internal rule labels, state names, and local plumbing terms while preserving external API keywords; main.py 70132→69559 chars with exact submission hash","timestamp":1774054557408,"segment":0,"confidence":5.289855608713985}
{"run":28,"commit":"e97506a","metric":69389899244,"metrics":{},"status":"keep","description":"Shortened the internal family labels plus inlined the tiny rp/main wrappers into the __main__ block, alongside another safe local/rule-token tightening pass; main.py 69559→69388 chars with exact submission hash","timestamp":1774056571390,"segment":0,"confidence":5.193406677674927}
{"run":29,"commit":"c527b72","metric":69303952499,"metrics":{},"status":"keep","description":"Tightened a few last small naming surfaces: shortened the canon100-derived feature prefix and compacted tiny helper parameter names (_tt/_xsp) while preserving external benchmark honesty and exact submission hash; main.py 69388→69302 chars","timestamp":1774058617962,"segment":0,"confidence":5.500686748547367}
{"run":30,"commit":"7b23c3c","metric":68407970065,"metrics":{},"status":"keep","description":"Removed non-essential progress logging, shortened unused error strings, dropped test-output counters, and collapsed the final submission write path to only the required file emission; main.py 69302→68406 chars with exact submission hash","timestamp":1774060808319,"segment":0,"confidence":6.15492096021667}
{"run":31,"commit":"8d2da2f","metric":68226039609,"metrics":{},"status":"keep","description":"Deleted tiny context/catboost wrapper helpers (_csc/_asc/_eca), inlined their one-shot logic, and dropped redundant CatBoost fit verbosity args; main.py 68406→68224 chars with exact submission hash","timestamp":1774062979475,"segment":0,"confidence":7.164751399134761}
{"run":32,"commit":"7d01ad5","metric":68166052081,"metrics":{},"status":"keep","description":"Removed the remaining explicit gc.collect calls and the now-unused gc import; CPython refcounting was sufficient here, and main.py shrank 68224→68164 while preserving the exact submission hash","timestamp":1774065134737,"segment":0,"confidence":7.497546036485924}
{"run":33,"commit":"7d01ad5","metric":0,"metrics":{},"status":"crash","description":"Tried another internal feature-name shortening pass, but renaming wattvar_ce only updated consumers like _arf and not the generic curve feature generator, causing a KeyError on missing column wve; reverted","timestamp":1774065403751,"segment":0,"confidence":7.497546036485924}
{"run":34,"commit":"bc8fffe","metric":67978139364,"metrics":{},"status":"keep","description":"Shortened another safe batch of internal feature names and model-integrity suffixes (rating ratios, spread/error fields, equality checks, DC/temp terms) without touching dynamic curve-name plumbing or external API keywords; main.py 68164→67976 with exact submission hash","timestamp":1774067599963,"segment":0,"confidence":8.107758612150787}
{"run":35,"commit":"cdf70ef","metric":67424102440,"metrics":{},"status":"keep","description":"Shortened another safe batch of local temporaries and internal feature names (adaptive-curve temps, model-integrity booleans, enter-service bounds, residual quantile vars, and capacity/control locals) with exact-token replacements only; main.py 67976→67422 with exact submission hash","timestamp":1774069781056,"segment":0,"confidence":8.838596890706281}
{"run":36,"commit":"cdf70ef","metric":0,"metrics":{},"status":"crash","description":"Tried a mixed cleanup pass: removed redundant residual-threshold init, elided several .copy() calls, reused FAM in two loops, and passed CatBoost the existing cat-feature list directly. The run finished but produced a wrong submission hash, so at least one of the copy removals was behaviorally significant; reverted","timestamp":1774072270445,"segment":0,"confidence":8.838596890706281}
{"run":37,"commit":"cdf70ef","metric":0,"metrics":{},"status":"crash","description":"Tried a smaller cleanup pass after the copy-elision crash: removed the duplicate tr/er/ur/q9r init in _aws, reused FAM in two hardcoded family loops, and passed CatBoost the existing cat-feature list directly. The submission hash changed because FAM is only {'c0','c1'} while those loops also need the 'o' family; reverted","timestamp":1774074205092,"segment":0,"confidence":8.838596890706281}
